manuscript,titles,authors,places
22761,Unknown,"Clay, Charles (Not much is known)",
,New Title,,
,,,
23787,Test Title!,,
22012,,,"Germany, Rhine Valley (Allemagne, valle du Rhin)"
23786,Chroniques. Premier Livre,"Monstrelet, Enguerrand de, approximately 1390-1453 (Monstrelet, Enguerrand de)","France, Cambrai (Cambray)"
23785,Book of Hours,,"France, Paris (Northern France (Paris))"
23787,"Missal, with occasional instructions for members of a monastic congregation",,French Flanders (probably Charleroi or vicinity) (sic)
23786,Breviary,,northern Italy (Florence)
,Devotional and Penitential Compendium,,Italy
23787,"Hymnal, with a Guidonian hand",,France
,Life of Saint Mary of Egypt set in Latin verse by the Carthusians of Cologne,,Germany (Cologne)
,Pocket prayerbook decorated with a rod of Asclepius,,Southern Germany or Switzerland
,"Calendar, probably from a monumental Missal",,Italy (Perugia ?)
,Fragment of a Gradual,,France
,"Anonymi versus de peccato; Nili CP. tetrastichon; Ordo sedium Thessalonicensi archiepiscoop obnoxiarum; Excerpta e SS. Patirbus de processione S. Spiritus, adversus Latinos; Marci Ephesini professio fidei in concilio Florentino; Typicon S. Sabae; S. Joannis Climaci scala paradisi; praemittuntur Joannis Raithuensis ad Joannem Sinaitam epistola; et S. Joannis Sinaitae vita in epitome; ejusdem liber ad pastorem; Leonis et Alexandri impp. constitutio adversus judices munere male fungentes; Matthaei Blastaris syntagma alphabeticum rerum omnium quae in sacris canonibus comprehenduntur; Photii, CP. patriarchae, collectanea de episcopis et metropolitis; Petri, Antiocheni patriarchae, responsum ad Dominic Gradensis epistolam; Leges colonariae; Officia magnae ecclesiae CP; Joannis Nesteutae, CP. patriarchae, methodus confitendi; Nicephori, CP. patriarchae, canones ecclesiastici XXXVII; Joannis, Citri episcopi, responsionum ad Constnatinum Cabasilam excerpta; Leonis imp. ordo thronorum sedi CP. obnoxiorum; explicatio vocum latinarum quae in libris juris canonici occurrunt; Theodori Balsamonis responsa ad Marci Alexandrini canonicas; S. Joannis Chrysostomi poenitentiarius liber; Joannis Nesteutae poenitentiarius liber; Regulae civiles et canonicae de nuptiis; Arbor consanguinitatis; Michaelis Pselli tractatus de omnifaria doctrina capita, quae ad terrae figuram, etc. spectant; S. Joannis Damsceni homilia in Christi nativitatem; Secundi philosophi fragmentum de mulieribus; De Francis, Longobardis, Alemannis, Vnetis et Calabris; S. Joannis Chyrsostomi liborum de sacerdotio fragmenta; Gennadii, CP. patriarchae, apologia ad Maximi, monachum montis Sinae; Fragmenta e S. Anastasio, etc","SS. Patribus; Eugenikos, Markos, Saint, approximately 1392-1445? (Marci Ephesini); John, Climacus, Saint, active 6th century (S. Joannis Climaci); Leo VI, Emperor of the East, 866-912 (Leonis); Alexander, Emperor of the East, approximately 870-913 (Alexandri impp.); Blastares, Matthew, active 14th century (Matthaei Blastaris); Photius I, Saint, Patriarch of Constantinople, approximately 820-approximately 891 (Photii, CP patriarchae); Petrus, Callinicus, Patriarch of Antioch, -591  (Petri, Antiocheni patriarchae); John IV, Patriarch of Constantinople (Joannis Nesteutae, CP. patriarchae); Nicephorus, Saint, Patriarch of Constantinople (Nicephori, CP. patriarchae); Joannis, Citri episcopi; Balsamon, Theodore (Theodori Balsamonis); John Chrysostom, Saint, -407 (S. Joannis Chrysostomi); Psellus, Michael (Michaelis Pselli); Secundus, of Athens, active 2nd century (Secundi philosophi); Gennadius II, Patriarch of Constantinople, approximately 1405-approximately 1472 (Gennadii, CP patriarchae); Anastasius, Sinaita, Saint, active 640-700 (S. Anastasio); Anonymi; Nilus, Saint, Archbishop of Constantinople (Nili)",
,"Photii, CP. patriarchae, disputatio de S. Spiritus processione; Collectanea e SS. Patribus de S. Spiritus processione; Paschalion breve; Becci scholia tria in SS. Basilii, Gregorii Nysseni et Cyrilli Alexandrini dicta, cum Arsenii monachi antirrheticis; Anonymi institutiones theologicae breves per interrog. et respons.; S. Anastasii Sinaitae quaestionum et S. Maximi de incarnatione excerpta; Justiniani imp. Novellarum selectae constitutiones; Gregorii Cyprii, CP. patriarchae, ad Andronicum Palaeologum imp. epistola de tomo in Beccum edito, etc; S. Joannis Damasceni ad Jordanem archimandritam epistola; Anonymi collectanea de patriarchis contra canones in locum legitimorum patriarcharum promotis; Gregorii Cyprii tomus contra Beccum; ejusdem professio fidei, adversus Marci libellum; ejusdem apologia; S. Gregorii Nazianzeni homilia tertia de pace; Synesii epistolae variae; S. Basilii adversus Eunomium libri V; ejusdem ad Amphilochium de S. Sprititu liber unus; Anonymi orthodoxi cum Anomoeo dialogi duo; Eunomii scholia; Aetii, Eunomii magistri, epistolae fragmentum; Macedonii et orthodoxi dialogus; S. Athanasii cum Apollinario dialogus; S. Gregorii, episcopi orthodoxi, dialogus cum Apollinarista; S. Maximi dialogus cum Pyrrho, CP. patriarcha; ejusdem de voluntatibus et operationibus capita decem; Theodori Abucarae dialogi XVIII","Gregory I, Pope, approximately 540-604 (S. Gregorii, episcopi orthodoxi); Maximus, Confessor, Saint, approximately 580-662 (S. Maximi); Abū Qurrah, Thāwdhūrus, approximately 750-825 (Theodori Abucarae); Photius I, Saint, Patriarch of Constantinople, approximately 820-approximately 891 (Photii, CP. patriarchae); SS. Patribus; Bekkos, Johannes, Patriarch of Constantinople, approximately 1235-1297 (Becci); Arsenios, Archbishop of Monemvasia, 1465-1535 (Arsenii); Anonymous (Anonymi); Anastasius, Sinaita, Saint, active 640-700 (S. Anastasii Sinaitae); Justinian I, Emperor of the East, 483?-565 (Justiniani imp.); Gregory II, of Cyprus, Patriarch of Constantinople, 1241-1290 (Gregorii Cyprii, CP. patriarchae); John, of Damascus, Saint (S. Joannis Damasceni); Gregory II, of Cyprus, Patriarch of Constantinople, 1241-1290 (Gregorii Cyprii); Gregory of Nazianzus, Saint (S. Gregorii Nazianzeni); Synesius, of Cyrene, Bishop of Ptolemais (Synesii); Basil, Saint, Bishop of Caesarea, approximately 329-379 (S. Basilii); Eunomius, Bishop of Cyzicus, approximately 335-approximately 394 (Eunomii); Aetius, approximately 313-approximately 370 (Aetii, Eunomii magistri); Athanasius, Saint, Patriarch of Alexandria, -373 (S. Athanasii)",
,Barlaami monachi adversus Latinos de processione S. Spiritus sermones II-V. et XVII-XVIII,"Barlaam Calabro, approximately 1290-1348 (Barlaami monachi)",
,Réfutation des Éléments de théologie de Proclus; rédaction abrégée de [Justin Martyr]; texte non identifié; Préparation; Questions des Chrétiens aux Grecs; lettre en latin de Jacques Gaffarel,"Nikolaos, Bishop of Methone, active 12th century (Nicolas de Méthone); Justin Martyr, Saint (Justin Martyr); Raïthu, Theodore of (Théodore de Raïthou); Gaffarel, Jacques, 1601?-1681 (Jacques Gaffarel)",
,"Nicolai Hydruntini adversus Judaeos dialogi, fine mutili; Anonymi homiliae de Christi baptismo et S. Stephano, initio et fine mutilae, siecle. XIII","Hydruntinus, Nicolaus (Nicolai Hydruntini); Anonymous (Anonymi)",
,"Meletii Pigae, Alexandrini patriarchae, evangelicae doctrinae periodus, fine mutilus; praemittuntur versus latini in laudem Meletii Pigae; Meletii ad Joannem Simontam epistola; et Demetrii Damiae protopsaltae monodia","Meletios I, Patriarch of Alexandria, approximately 1551-1601 (Meletii Pigae, Alexandrini patriarchae); Meletios I, Patriarch of Alexandria, approximately 1551-1601 (Meletii); Demetrius Damias (Demetrii Damiae)",
,Manuelis Palaeologi cum Persa quodam de Christianae religionis veritate dialogi XXVI,"Manuel II Palaeologus, Emperor of the East, 1350-1425 (Manuelis Palaeologi)",
,"Bonacursii Bononiensis, ordinis Praedicatorum, thesaurus veritatis fidei, cum graeca versione Andreae Doto, initio et fine mutilus","Bonaccorso, da Bologna, approximately 1230- (Bonacursii Bononiensis); Dotus, Andreas (Andreae Doto)",
,"Bonacursii Bononiensis, ordinis Praedicatorum, thesaurus veritatis fide, cum graeca versione Andreae Doto","Bonaccorso, da Bologna, approximately 1230- (Bonacursii Bononiensis); Dotus, Andreas (Andreae Doto)",
,"S. Nicephori, CP. patriarchae, adversus Iconomachos antirrheticorum libri II., initio mutili","Nicephorus, Saint, Patriarch of Constantinople (S. Nicephori, CP. patriarchae)",
,"Theophanis, Nicaeni metropolitae, disputatio de aeternitate mundi; Pauli, Latinae ecclesiae episcopi, ad Joannem Cantacuzenum; Thophanis Nicaeni ad Paulum responsio brevior; ejusdem responsio uberior, libris V; epistola ad Nicaenos clericos; ad gregem suam, de patientia; Joasaphi [Joannis Cantacuzeni] contra sectam Mahometicam apologiae IV; ejusdem contra Mahometem orationes IV","Theophanes, Bishop of Nicaea, -1381 (Theophanis, Nicaeni metropolitae); Paul I, Pope, -767 (Pauli, Latinae ecclesiae episcopi); John VI Cantacuzenus, Emperor of the East, 1292-1383 (Joasaphi [Joannis Cantacuzeni])",
,Nicolai Cabasilae de vita in Christo libri VII; homilia in nativitatem Deiparae; in annuntiationem beatae Mariae; in dormitionem beatae Mariae; in passionem Christi; in ascensionem Christi; in laudem S. Nicolai Thaumatrugi; Maximi Planudis homilia in Christi sepulturam,"Cabasilas, Nicolaus, active 14th century (Nicolai Cabasilae); Planudes, Maximus, approximately 1260-approximately 1310 (Maximi Planudis)",
,"Davidis Dishypati ad Nicolaum Cabasilam liber de Barlaami et Acindyni blasphemiis; S. Gregorii Nysseni homilia in illud Geneseos : Ad imaginem Dei et similitudinem; Tarasii, CP. patriarchae, ad Hadrianum papam I. contra simoniam epistola; Joannis Cantacuzeni responsio ad dicta Prochori de essentia et operatione divina; ejusdem antirrheticorum liber ad dicta Patrum a Prochoro allata; ejusdem ad Isaacum Argytrum liber de operatione S. Spiritus; Gregorii Palamae de processione S. Spiritus liber I","Disypatos, David (Davidis Dishypati); Gregory, of Nyssa, Saint, approximately 335-approximately 394 (S. Gregorii Nysseni); Tarasius, Saint, Patriarch of Constantinople, 730-806 (Tarasii); John VI Cantacuzenus, Emperor of the East, 1292-1383 (Joannis Cantacuzeni); Gregory Palamas, saint, 1296-1359 (Gregorii Palamae)",
,"Joannis Cyparissiotae Palamitarum transgressionum libri IV; adversus Palamae tomum ejusque novam fidem libri VIII; de lumine increato, adversus Palamam, libri VIII; contra Palamitarum apostasiam libri III; adversus Nilum Thessalonicensem antirrhetiocrum libri V; Novi errores exorte inter Grecos","John, Kyparissiotes, approximately 1310-1378 or 1379 (Joannis Cyparissiotae)",
,"Philothei, CP. patriarchae, adversus Nicephorum Gregoram antirrheticorum libri XII; ejusdem de divina operatione et de Thaborio lumine libri III","Philotheos, Patriarch of Constantinople (Philothei, CP. patriarchae)",
,"Joasaphi [Joannis Cantacuzeni] sub nomine Christoduli monachi, adversus Judaeos libri IX; contra sectam Mahometicam apologiae IV; contra Mahometem orationes IV","John VI Cantacuzenus, Emperor of the East, 1292-1383 (Joasaphi [Joannis Cantacuzeni])",
,"Joasaphi [Joannis Cantacuzeni imp.] adversus Prochorum antirrhetici I, cap. I; praemittitur Christoduli monachi prooemium tomi contra Barlaam et Acindynum; adversus Isaacum Argyrum liber; ad Paulum, e Latinis patriarcham, epistola adversus Barlaami et Acyndini blasphemias; contra sectam Mahometicam apologiae IV; contra Mahometem orationes IV; adversus Judaeos libri IX","John VI Cantacuzenus, Emperor of the East, 1292-1383 (Joasaphi [Joannis Cantacuzeni imp.); Christodulos (Christoduli monachi)",
,"Prochori Cydonii disputatio de lumine Thaborio adversus Palamitas; Joasaphi [Joannis Cantacuzeni imp.] adversus Prochorum antirrheticorum libri duo; ejusdem ad Paulum, e Latinis patriarcham, epistola adversus Barlaami et Acyndini blasphemias","Prochorus, Saint, active 1st century (Prochori Cydonii); John VI Cantacuzenus, Emperor of the East, 1292-1383 (Joasaphi [Joannis Cantacuzeni imp.])",
,"Prochori Cydonii disputatio de lumine Thaborio adversus Palamitas; Joasaphi [Joannis Cantacuzeni imp.] adversus Prochorum antirrheticorum libri duo; ejusdem ad Paulum, e Latinis patriarcham, epistola adversus Barlaami et Acyndini blasphemias","Prochorus, Saint, active 1st century (Prochori Cydonii); John VI Cantacuzenus, Emperor of the East, 1292-1383 (Joasaphi [Joannis Cantacuzeni imp.])",
,"ejusdem vita S. Petri, Athonitae; decalogus N. Testamenti; de passionibus, virtutibus et mentalis quietudinis fructibus; ad moleste ferentes casus varios qui nobis accidunt; ad interrogantem de susceptione monachici habitus; epistola ex Asia ad suam ecclesiam, dum servus esset; disputatio adversus infideles et atheos Chionas; Gregorii Palamae homiliae LXIII; orationes ad Deum, cum pontificatum capesseret; cum populos inviseret; tempore pluviali; coram regibus poast unctionem; capita de oratione et cordis puritate; alia capita de eodem","Gregory Palamas, saint, 1296-1359 (Gregorii Palamae)",
,"diatribae duae contra scriptum Ignatii, Antiocheni patriarchae; ad Philotheum, postea CP. patriarcham; ad monachos in monte Atho epistola; epistola ad Macarium hieromonachum; Gregorii Palamae, Thessalonicensis archiepiscopi, selecta testimonia e sacra Scriptura et SS. patribus; ejusdem compendiosa narratio dialogi, coram imperatore, cum Nicephoro Gregori habiti; Iambi DCXVIII. adversus Acindynum; Gregorii Palamae ad Annam Palaeolginam epistola; ejusdem adversus Acindynum libri X; ejusdem ad Dionysium monachum epistola; libri duo apologetici, cum Nicolai Pepagomeni epistola; quod Barlaam et Acindynus divinitatem unam in duas discerpant liber unus; dialogi duo, orthodoxi cum Barlaamita, et Theophanis orthodoxi cum Theotimo; opusculum quo variis Acyndini scriptits respondere conatur; epistolae ad Joannem Gabram; ad Daniele, Aeni metroplitam; ad Nomophylacem; ad Acindynum, ante condemnationem; Arsenii, monachi Studitae, ad Gregorium Palamam epistola cum responsione; Gregorii Palamae ad Paulum Asanum epistola; ejusdem oratio adversus Joannem Calecam, CP. patriarcham","Gregory Palamas, saint, 1296-1359 (Gregorii Palamae); Pepagomenus, Nicolaus (Nicolai Pepagomeni); Barlaam Calabro, approximately 1290-1348 (Barlaam); Akindynos, Gregorios, approximately 1300-approximately 1349 (Acindynus); Arsenius (Arsenii, monachi Studitae); Gregory Palamas, saint, 1296-1359 (Gregorium Palamam)",
,"S. Thomae Aquinatis summae theologicae pars secunda, a Demetrio Cydonio graece versa","Thomas, Aquinas, Saint, 1225?-1274 (S. Thomae Aquinatis)",
,"S. Thomae Aquinatis summa adversus gentes, libris IV., a Demetrio Cydonio, graece versa","Thomas, Aquinas, Saint, 1225?-1274 (S. Thomae Aquinatis)",
,"S. Thomae Aquinatis summae theologicae pars secunda, a Demetrio Sydonio graece versa","Thomas, Aquinas, Saint, 1225?-1274 (S. Thomae Aquinatis)",
,"Michaelis Choniatae monodia in fratris sui Nicetae mortem; Fragmentum e Speculo S. Augustini, etc; Josephi monachi, CP. patriarchae, epistolae; Nicetae Choniatae Acominati thesauri orthodoxae fidei libri XXVI., fine mutila; inserta sunt : Michaelis, CP. patriarchae, opusculua adversus Latinos et de azymis; De VII. synodis oecumenicis; Eustathii Romani fragmentum de duobus fratribus duas sorores ducentibus; Michaelis, CP patriarchae, epistolae variae ad imperatorem; Nicephori, CP. patriarachae, interrogationes et responsiones; Alexii, CP. patriarchae, constitutiones duae de rebus ecclesiasticis; Alexii Comneni imp. bulla aurea de rebus sacris; Nicolai amascae, Nicephori Hierosolymit., sacerdotis cujusdam, Germani CP. et Nicolai, CP. patriarchae, fragmenta varia","Choniates, Michael, 1138-approximately 1222 (Michaelis Choniatae); Augustine, Saint, Bishop of Hippo (S. Augustini); Josephus, hieromonachus et sacrista magnae ecclesiae CP. (Josephi monachi); Choniates, Nicetas, approximately 1140-1213 (Nicetae Choniatae Acominati); Michael, Cerularius, Patriarch of Constantinople, approximately 1000-1059 (Michaelis, CP. patriarchae); Eustathius of Rome (Eustathii Romani); Alexius Studites (Alexii, CP, patriarchae); Alexius I Comnenus, Emperor of the East, 1048-1118 (Alexii Commeni imp.); Nicolaus Amaseensis (Nicolai Amascae); Nicephorus, Saint, Patriarch of Constantinople (Niceophori Hierosolymit.); Germanus I, Saint, Patriarch of Constantinople, -approximately 733 (Germani CP.); Nikolaos I, Mystikos, Saint, Patriarch of Constantinople, 852-925 (Nicolai, CP. patriarchae)",
,"Euthymii Zigabeni panoplia dogmatica fidei, initio mutila; Photii, CP. patriarchae, epistola de septem generalibus conciliis; S. Joannis Damsceni dialectica; Anonymi opusculum de virtutibus et vitiis; S. Joannis Damasceni expositio accurata orthodoxae fidei, fine mutila","Zigavēnos, Euthymios, approximately 1050-approximately 1118 or 1120 (Euthymii Zigabeni); Photius I, Saint, Patriarch of Constantinople, approximately 820-approximately 891 (Photii, CP. patriarchae); John, of Damascus, Saint (S. Joannis Damasceni); Anonymous (Anonymi)",
,"Euthymii Zigabeni panoplia dogmatica orthodoxae fidei; Valentis astronomi thema genethliacum CP., ex S. Hippolyto; Fragmenta de nominis Jacobitarum, Melchitarum et Chatzizariorum origine","Zigavēnos, Euthymios, approximately 1050-approximately 1118 or 1120 (Euthymii Zigabeni); Valens, Vettius (Valentis astronomi); Hippolytus, Antipope, approximately 170-235 or 236 (S. Hippolyto)",
,"Euthymii Zigabeni panoplia domgatica orthodoxae fidei; Photii, CP. patriarchae, epistola de septem generalibus conciliis","Zigavēnos, Euthymios, approximately 1050-approximately 1118 or 1120 (Euthymii Zigabeni); Photius I, Saint, Patriarch of Constantinople, approximately 820-approximately 891 (Photii, CP. patriarchae)",
,"Euthymii Zigabeni panoplia dogmatica orthodoxae fidei; Photii, CP. patriarchae, epistola de septem generalibus conciliis; Notitia epsicopatuum sedi CP. subjectorum","Zigavēnos, Euthymios, approximately 1050-approximately 1118 or 1120 (Euthymii Zigabeni); Photius I, Saint, Patriarch of Constantinople, approximately 820-approximately 891 (Photii, CP. patriarchae)",
,"Euthymii Zigabeni panoplia dogmatica orthodoxae fidei; Photii, CP. patriarchae, epistola ad septem generalibus conciliis","Zigavēnos, Euthymios, approximately 1050-approximately 1118 or 1120 (Euthymii Zigabeni); Photius I, Saint, Patriarch of Constantinople, approximately 820-approximately 891 (Photii, CP. patriarchae)",
,"Photii, CP. patriarchae, responsa ad Amphilochii quaestiones; ejusdem disciplina arcana de S. Spiritu; ejusdem adversus recentes Manichaeos sive Paulicianos libri IV","Photius I, Saint, Patriarch of Constantinople, approximately 820-approximately 891 (Photii, CP. patriarche)",
,Livre d'heures manuscrit à l'usage de Troyes,,Champagne ou Franche-Comté
,Antiphonar,,
,"Photii, CP. patriarchae, Bibliothecae capita I-LVIII; praemissus est index capitum CCLXII","Photius I, Saint, Patriarch of Constantinople, approximately 820-approximately 891 (Photii, CP. patriarchae)",
,"Photii, CP. patriarchae, Bibliotheca","Photius I, Saint, Patriarch of Constantinople, approximately 820-approximately 891 (Photii, Cp. patriarchae)",
,Nicephori Blemmidae homilia in laudem S. Joannis Theologi; S. Athanasii Alexandrini homilia in Hypapanten,"Nicephorus, Blemmydes, 1197-1272 (Nicephori Blemmidae); Athanasius, Saint, Patriarch of Alexandria, -373 (S. Athanasii Alexandrini)",
,"Anonymi homiliae variae, initio et fine mutilae; homilia II. de fide",Anonymous (Anonymi),
,"Anonymi doctrinae, seu homiliae in evangelium Publicani et Pharisaei; in Filium prodigum; de extremo judicio; in Dominicas I-IV. quadragesimae; in Annuntiationem; in Dominicam quintam quadragesimae; de resurrectione Lazari; in magnum quatriduum; in sanctum Parasceven; de resurrectione Domini; omnia linguae graeca vulgari",Anonymous (Anonymi),
,"Homiliae in evangelia dominicalia totius anni; Theophylacti, Bulgariae archiepiscopi, commentarius in XI. evangelia matutina","Theophylactus, of Ochrida, Archbishop of Ochrida, approximately 1050-approximately 1108 (Theophylacti, Bulgariae archiepiscopi)",
,Homiliae in evangelia dominicalia totius anni ; finis desideratur,,
,"excerpta ex ejsudem vita; Nili monachi opusculum de eodem; Anastasii, Antiocheni patriarchae, opusculum de servandis tribus quadragesimis; Nicephori, CP. patriarchae epistola; S. Maximi fragmentum de amicitia; S. Gregorii Nazianzeni tragoedia Christus patiens; Epicteti enchiridion interpolatum; Apophthegmata sapientum et regum; Joannis Colobi dicta; Excerpta ex dictis SS. Patrum, Anastasio Sinaita, etc; ejusdem ad Anatolium liber de octo vitiosis cogitationibus; Anonymi homilia; Heremetis Trismegisti Poemander; Asclepii definitiones ad regem Ammonem, de Deo, materia, etc; Sententiae monostichae variorum poetarum, alphabet; S. Gregorii Nazianzeni tetrasticha, cum Nicetae Davidis commentario; ejusdem carmina omnia; epigrammata in S. Basilii sepulchrum, cum Nicetae Davidis commentariis; Eclogae ex V. Testamento de trinitate et incarnatione; Nonni Panopolitani paraphrasis metrica evangelii S. Joannis; Maximi Planudis homilia in Christi sepulturam; Evagrii monachi opusculum de vestibus monachorum Aegypti; ejusdem definitiones affectuum animae rationalis; ejusdem sententiae morales","Anonymous (Anonymi); Hermes Trismegistus (Hermetis Trismegisti); Asclepius, of Tralles (Asclepii); Gregory of Nazianzus, Saint (S. Gregorii Nazianzeni); Nicetas, the Paphlagonian, active 10th century (Nicetae Davidis) (Com); Basil, Saint, Bishop of Caesarea, approximately 329-379 (S. Basilii); Nonnus, of Panopolis (Nonni Panopolitani); Planudes, Maximus, approximately 1260-approximately 1310 (Maximi Planudis); Evagrius monachus (Evagrii monachi); Nilus Monachus (Nili monachi); Anastasius, Sinaita, Saint, active 640-700 (Anastasii, Antiocheni patriarchae); Nicephorus, Saint, Patriarch of Constantinople (Nicephori, CP. patriachae, epistolas); Maximus, Confessor, Saint, approximately 580-662 (S. Maximi); Gregory of Nazianzus, Saint (S. Gregorii Nazianzeni); Epictetus (Epicteti); John, the Little, Saint, approximately 339-409 (Joannis Colobi); SS. Patrum; Anastasius, Sinaita, Saint, active 640-700 (Anastasio Sinaita)",
,"Eusebii Caesariensis homilia in ingressum jejuniorum; Vita S. Nicolai, Myrensis archiepiscopi; Andreae Hierosolymitani homilia in laudem S. Nicolai Myrensis; Gregorii, Thessalonicensis archiepiscopi, homilia in Annuntiationem; ejusdem homilia in Dominicam palmarum; Anonymi homilia in Annuntiationem; in Christi nativitatem; in Christi baptismum; in Transfigurationem; adversus blasphemantes; de jurejurando; S. Joannis Chrysostomi homilia de S. Spiritu; Martyrium S. Demetrii, initio mutilum; Andreae Cretensis homilia in sanctam crucem; Procopii diaconi et chartophylacis homilia in SS. Michaelem et Gabrielem; Anastasii Sinaitae responsiones variae; Anonymi homilia de extremo judicio, initio mutila","Anonymous (Anonymi); Eusebius, of Caesarea, Bishop of Caesarea, approximately 260-approximately 340 (Eusebii Caesariensis); Andrew, of Crete, Saint, approximately 660-740 (Andreae Hierosolymitani); Gregory Palamas, saint, 1296-1359 (Gregorii, Thessalonicensis archiepiscopi); Andrew, of Crete, Saint, approximately 660-740 (Andreae Cretensis); John Chrysostom, Saint, -407 (S. Joannis Chrysostomi); Procopius, of Gaza, approximately 475-approximately 528 (Procopii diaconi et chartophylacis); Anastasius, Sinaita, Saint, active 640-700 (Anastasii Sinaitae)",
,"Josephi, hieromonachi et sacristae magnae ecclesiae, homiliae duae in laudem S. Bartholomaei apostoli; Alexandri monachi homilia in laudem S. Barnabae; Iter et martyrium S. Barnabae apostoli; Acta S. Aquilae, unius e LXX. discipulis Christi; Iter et martyrium S. Philippi apostoli; Martyrium S. Apollinis apostoli; Martyrium S. Thimothei apostoli; Narratio de inventione vestis beatae Mariae in Blachernis; Vita Sae. Xenes","Josephus, hieromonachus et sacrista magnae ecclesiae CP. (Josephi, hieromonachi et sacristae magnae ecclesiae); Alexandros, monachos, active 6th century (Alexandri monachi); Theodore, Studites, Saint, 759-826 (Theodorus, CP. presbyter et syncellus)",
