manuscript,titles,authors,places
,S. Gregorii Nazianzeni oratio I. in S. Pascha; in novam dominicam; in Pentecosten; in Christi nativitatem; in sancta lumina; oratio valedictoria coram CL. episcopis; in sanctum baptisma; de pauperibus caritate complectendis; de dogmate et officio episcoporum; de theologia oratio II; ad Aegyptios; in laudem S. Athanasii; in laudem Cypriani martyris; in laudem Macchabaeorum; in laudem Heronis philosophi [Maximi Cynici]; in laudem S. Basilii; coram S. Gregorio Nysseno; ad Nazianzenos qui se acciverant; de fuga in Pontum; in laudem Caesarii fratris; ad patrem cum Nazianzenae ecclesiae curam sibi commisisset; ad patrem cum Sasimorum episcopus unctus esset; de episcopi munere aegre suscepto; in Julianum exaequatorem; in praefectum irascentem; in plagam grandinis; in laudem sororis Gorgoniae; in laudem patris; de pace orationes I. et II; adversus Eunomianos oratio de theologia; in Pascha et in tarditatem; Macarii epistola ad fratres,"Gregory of Nazianzus, Saint (S. Gregorii Nazianzeni); Macarius, the Egyptian, Saint, active 4th century (Macarii)",
,"S. Gregorii Nazianeni orationes, cum [Eliae Cretensis] scholiis, de theologia V; ad Aegyptios; in laudem Caesarii fratris; in Julianum apostatam orationes duae; de fuga in Pontum; de pace orationes tres; in laudem patris; adversus Arianos de multitudine sua gloriantes; adversus Eunomianos praevia disputatio; ad Nectarium, CP. episcopum, epistola; in illud Matthaei: Cum consummasset Jesus hos sermones; in electione Eulalii, Doarensium episcopi; ad Evagrium monachum epistola; annotatio de IV. apud Ezechielem animalibus; paraphrasis in Ecclesiasten; in praefectum irascentem; ad patrem, cum Nazianzenae ecclesiae curam sibi commisisset; ad patrem, cum Sasimorum episcopus unctus esset; post reditum e fuga; in laudem sororis Gorgoniae; de virginitate; de moderatione in disputationibus servanda; Vita S. Gregorii Nazianzeni, in epitome, ex Menologio; Troparion en eumdem","Gregory of Nazianzus, Saint (S. Gregorii Nazianzeni); Elias Cretensis (Eliae Cretensis) (Com)",
,"S. Gregorii Nazianzeni homiliae, cum scholiis, in S. Pascha duae; in novam Dominicam; in Pentecosten; in Macchabaeos; in laudem Cypriani martyris; in Julianum exaequatorem orationes duae; oratio funebris in laudem S. Basilii; in S. Theophania; exhortatio ad baptismum; in laudem Gregorii, fratris S. Basilii; in laudem S. Athanasii; in plagam grandinis; de pauperibus caritate complectendis; homilia valedictoria in praesentia CL. episcoporum","Gregory of Nazianzus, Saint (S. Gregorii Nazianzeni)",
,"Symeonis Metaphrastae sermones XXIV. de moribus, e variis S. Basilii operibus selecti","Symeon, Metaphrastes, active 10th century (Symeonis Metaphrastae); Basil, Saint, Bishop of Caesarea, approximately 329-379 (S. Basilii)",
,"Symeonis Metaphrastae sermones XXIv. de moribus, e variis S. Basilii operibus selecti","Symeon, Metaphrastes, active 10th century (Symeonis Metaphrastae); Basil, Saint, Bishop of Caesarea, approximately 329-379 (S. Basilii)",
,S. Basilii ad Gregorium Nazianzenum de vita eremitica epistola; Plutarchi de animi tranquillitate; de fortuna Romanorum; de fortuna Alexandri Magni libri II,"Basil, Saint, Bishop of Caesarea, approximately 329-379 (S. Basilii); Plutarch (Plutarchi)",
,S. Basilii epistolae variae,"Basil, Saint, Bishop of Caesarea, approximately 329-379 (S. Basilii)",
,"S. Basilii epistolae variae; S. Joannis Damasceni fragmenta de orthodoxa fide et idiomatum; Photii, CP. patriarchae, de Spiritus sancti processione; S. Gregorii pape ad Germanum, CP. patriarcham, fidei expositio; cum Germani responsione ad papam et ad legatos Minoritas de Spiritus sancti processione; S. Basilii homilia in Christi nativitatem; exhortatio ad baptismum; homilia in laudem XL. martyrum; in laudem Barlaami martyris; in laudem Gordii martyris; in ebriosos; adversus irascentes; de invidia; de humilitate; in illud: Destruam horrea mea; adversus ditescentes; in illud: In principio erat Verbum; de fide; de Spiritu sancto; Nicolai Cabasilae homilia de usura, initio mutila; Anonymi homilia in nativitatem b. Mariae; Nicolai Cabasilae homilia in ascensionem Domini; ejusdem homilia in Annuntiationem; Narratio de quibusdam in Hungaria prodigiose factis, a 1454, sept. 13; Gregorii Palamae homiliae duae in ingressum Deiparae in sancta sanctorum; de praemiis et poenis bonos et malos post Domini adventum manentibus; in crucem Domini; in festum Purificationis; in Annuntiationem; in Ascensionem homiliae duae; ejusdem hypotheses XVI. e PP. et conciliis; inter quas Nicolai Pepagomeni ad Gregorium Thessalonicensem; Disputatio in palatio coram imperatore Gregorium Thessalonicensem inter et Nicephorum Greogram habita; Theophanis orthodoxi disputatio cum quodam Barlaamita; ejusdem disputatio cum Theotimo de divinitate; Confutatio illorum quae Acindynus adversus Barlaamum scripsit; Anonymi apologia do divinis operationibus et secundum illas participatione; Anonymi de deifica participatione; Anonymi de eo quod Acindynus et Barlaamus impie dividant unam divinitatem in duas aequales; Nota de expugnatione CP","Basil, Saint, Bishop of Caesarea, approximately 329-379 (S. Basilii); John, of Damascus, Saint (S. Joannis Damasceni); Photius I, Saint, Patriarch of Constantinople, approximately 820-approximately 891 (Photii, CP. patriarchae); Gregory I, Pope, approximately 540-604 (S. Gregorii pape); Germanus I, Saint, Patriarch of Constantinople, -approximately 733 (Germanum); Cabasilas, Nicolaus, active 14th century (Nicolai Cabasilae); Anonymi; Gregory Palamas, saint, 1296-1359 (Gregorii Palamae); Pepagomenus, Nicolaus (Nicolai Pepagomeni); Theophanes, the Confessor, -approximately 818 (Theophanis orthodoxi)",
,"S. Basilii epistola CXLI; homilia adversus calumniantes quod tres Deos colamus; epistola CCCI; de Spiritu sancto liber ad Amphilochium; adversus Eunomium libri V; homilia de fide; homilia de eo quod incomprehensibilis sit Deus [Cyrilli Hierosolymit catechesis IX.]; insanctum baptisma; de judicio et misericordia; de illuminatione sive baptismo [Cyrilli Hierosolymit.]; adversus Sabellianos; ad Letoium liber de vera virginitate; homilia in ebriosos; de invidia; in laudem Barlaami maryttris; epistola LXXVIII; homilia de humilitate; epistola LXXIX; et epistola CCC. finis; Fragmentum de S. Trinitate; Michaelis Pselli ad Michaelem Ducam imp. responsa de rebus theologicis; Maximi explicatio quorumdam Scripturae locorum, ubi de Christo; Manuelis Moschopuli adversus Latinos de processione Spiritus sancti; Adronici Palaeologi apophthegmata; Excerpta e SS. Joanne Chrysostomo et Maximo","Basil, Saint, Bishop of Caesarea, approximately 329-379 (S. Basilii); Cyril, Saint, Bishop of Jerusalem, approximately 315-386 (Cyrilli Hierosolymit.); Psellus, Michael (Michaelis Pselli); Maximus, Confessor, Saint, approximately 580-662 (Maximi); Moschopoulos, Manuel, approximately 1265?- (Manuelis Moschopuli); Andronicus II Palaeologus, Emperor of the East, 1260-1332 (Andronici Palaeologi); John Chrysostom, Saint, -407 (S. Joanne Chrysostomo)",
,"Anonymi ad imperatorem epistola; SS. Basilii et Greogrii Nazianzeni epistolae mutuae; S. Basilii homiliae IX. in Hexaemeron; S. Gregorii Nysseni homiliae tres de hominis opificio; ejusdem explicatio apologetica in Hexaemeron; Michaelis Pselli et Basilii Megalomitae aenigmata; S. Basilii homiliae in ebriosos; in illud: Attende tibi ipsi; in laudem Barlaami martyris; in laudem Gordii martyris; exhortatio ad baptismum; in laudem XL. martyrum; in Christi nativitatem; S. Joannis Chrysostomi homilia in laudem Babylae martyris; Nicolai Cabasilae expositio missae; Petri, Antiocheni patriarchae, ad Dominicum gradensem epistola; Joannis Russiae metropolitae, epistola ad Clementem papam; Excerpta de Spiritus sancti processione; De VII. conciliis oecumenicis","Anonymi; Basil, Saint, Bishop of Caesarea, approximately 329-379 (S. Basilii); Gregory of Nazianzus, Saint (S. Gregorii Nazianzeni); Gregory, of Nyssa, Saint, approximately 335-approximately 394 (S. Gregorii Nysseni); Psellus, Michael (Michaelis Pselli); Megalomites, Basilius (Basilii Megalomitae); John Chrysostom, Saint, -407 (S. Joannis Chrysostomi); Cabasilas, Nicolaus, active 14th century (Nicolai Cabasilae); Petrus, Callinicus, Patriarch of Antioch, -591  (Petri, Antiocheni patriarchae); John, Metropolitan of Russia (Joannis, Russiae metropolitae)",
,"S. Basilii epistolae variae CCCXXXVI; S. Joannis Chrysostomi ad Olympiadem epistolae XVI; ejusdem epistola ad Innocentium, Romae episcopum; ejusdem epistola ad Cyriacum episcopum; S. Gregorii Nazianzeni sententiae tetrastichae; ejusdem monosticha alphabetica; epigrammata in mortem S. Basilii; versus varii; Isidori Pelusiotae epistolae VII; Juliani imp. ad Libanium epistola; Anonymi versus duo in horologium; Dionysii Areopagitae epistola ad Joannem evangelistam; Symeonis, Euchaitarum metropolitae, ad Joannem monachum epistolae; S. Gregorii Nysseni fragmentum de humanae vitae miseriis; Anonymi christianae fidei expositio; Anonymi de septem hominis aetatibus; Anonymi quot annos vixerit b. Maria; Chronici fragmentum a creatione mundi ad VII. usque synodum; Varia de computo","Basil, Saint, Bishop of Caesarea, approximately 329-379 (S. Basilii); John Chrysostom, Saint, -407 (S. Joannis Chrysostomi); Gregory of Nazianzus, Saint (S. Gregorii Nazianzeni); Isidore, of Pelusium, Saint, active 5th century (Isidori Pelusiotae); Julian, Emperor of Rome, 331-363 (Juliani imp.); Anonymi; Dionysius, the Areopagite, Saint, active 1st century (Dionysii Areopagitae); Symeon, Metropolitan of Euchaitarus (Symeonis, Euchaitarum metropolitae); Gregory, of Nyssa, Saint, approximately 335-approximately 394 (S. Gregorii Nysseni)",
,S. Basilii adversus Eunomium libri V; ejusdem ad Amphilochium Iconiensem liber de Spiritu sancto,"Basil, Saint, Bishop of Caesarea, approximately 329-379 (S. Basilii)",
,Eunomii apologeticus; S. Basilii adversus Eunomii apologiam antirrheticorum libri V; ejusdem ad Amphilochium Iconiensem liber de Spiritu sancto,"Eunomius, Bishop of Cyzicus, approximately 335-approximately 394 (Eunomii); Basil, Saint, Bishop of Caesarea, approximately 329-379 (S. Basilii)",
,"S. Basilii oratio de abdicando saeculo et spirituali perfectione; dignotio asceticarum informationum; hypotyposeos vitae asceticae prologus; prooemium ad ethica, de judicio Dei; de fide; proeemium breve ad ethica; capita moralia LXXX. e N. Testamento; prologus monachorum fusius disputatae; regulae breviores; de baptismo libri duo; constitutiones monasticae; ad Chilonem epistola; de institutione vitae religiosae; de exercitatione monastica; admonitio brevis ad juniores monachos; admonitio ad monachum lapsum; poenae in monachos et monachas delinquentes","Basil, Saint, Bishop of Caesarea, approximately 329-379 (S. Basilii)",
,"S. Basilii homilia ad adolescentes de legendis gentilium libris; Libanii allocutio panegyrica ad Julianum Antiochiae versantem; Aristidis de Smyrna terrae motu obruta epistola, ad impp. Marcum Antoninum et Commodum; Libanii declamatio I., Menelai ad Trojanos oratio; ejusdem oratio de inexplebii cupiditate; ejusdem oratio qua ostenditur amicos optimas esse divitias; ejusdem descriptio veris; Juliani imp. epistolae XVIII. et Libanii duae; Libanii parentatio in Julianum imp; ejusdem lamentatio ad Antiochenos de Daphnaei Apollinis fano; ejusdem lamentatio de Nicomedia; Michaelis Acominati versus iambici de pristina Athenarum dignitate; S. Joannis Damasceni capita philosophica, theologica et physica; Georgii Gemisti Plethonis oratio funebris in obitum Cleopae Palaeologinae; ejusdem de virtutibus tractatus; Timaei Locrensis de anima mundi; Isocratis oratio ad Demonicum; Aristidis oratio Ulyssis nomine ad Achillem; Aristotelis de virtutibus et vitiis; ejusdem excerpta de ethicis et politicis; Marci Eugenici ad imperatorem epistola de poenarum aeternitate; ejusdem ad eumdem epistola de morte; Ciceronis somnium Scipionis, a Maximo Planude graece versum; Demetrii Cydonii homilia de contemnenda morte; Hermiae philosophi introductio in isagogen Porphyrii; Thucydidis orationes, ex historiis excerptae","Basil, Saint, Bishop of Caesarea, approximately 329-379 (S. Basilii); Libanius (Libanii); Aristides, Aelius (Publius Aelius), ca117-ca189 (Aristidis de Smyrna); Julian, Emperor of Rome, 331-363 (Juliani imp.); John, of Damascus, Saint (J. Joannis Damasceni); Gemistus Plethon, George, active 15th century (Georgii Gemisti Plethonis); Timaeus, of Locri (Timaei Locrensis); Isócrates (Isocratis); Eugenikos, Markos, Saint, approximately 1392-1445? (Marci Eugenici); Choniates, Michael, 1138-approximately 1222 (Michaelis Acominati); Cicero, Marcus Tullius (Ciceronis); Demetrius Cydones, approximately 1324-approximately 1398 (Demetrii Cydonii); Platonicus, Hermias (Hermiae philosophi); Platonicus, Hermias (Hermias Platonicus); Thucydides (Thucydidis)",
23730,"Dominican Miscellany; Compendium theologicae veritatis; Epistola ad Lombardum de Siricho; Probatio adventus Christi; Commentary on the Lord's Prayer; Expositio symbolum apostolorum; Noted sequences, Ave virgo virginum and Tibi cordis in altari; Tractatus de articulis fidei et sacramentis ecclesie; Tractatus de eternitate mundi; De quibusdam articulis ad fratrem Girardum Bisuntinum; Tractatus de decem praeceptis; Questiones from the Dominican General Chapter at Paris in 1279; other short texts","Hugo, Argentinensis, approximately 1210-approximately 1270. (Hugo Ripelin Argentinensis); Petrarca, Francesco, 1304-1374 (Francesco Petrarch); Nicholas, of Lyra, approximately 1270-1349 (Nicolaus de Lyra); Aldobrandinus, de Toscanella, -1314 (Aldobrandinus de Tuscanella); Thomas, Aquinas, Saint, 1225?-1274 (Thomas Aquinas)","Italy, northern (Italy (Northern?))"
23731,Sermones de sanctis; Sermones de communi sanctorum,"Haqueville, Nicolaus de (Nicolaus de Aquavilla [Nicolas D'Hacqueville])","France, northern, Paris (France (Paris?))"
1014,"Choir Breviary; other texts; Ordinationes; Indutus planeta; Franciscan Liturgical Statues from Metz, 1254; Benedictions",,"Italy, northern, Umbria (Central or Northern Italy (Umbria?)); Italy, central"
21716,Summa de poentitentia,"Raymond, of Peñafort, Saint, 1175?-1275 (Raymundus de Penaforte)","France, northern, Paris (Northern France, Paris)"
23723,Liturgical Calendar,,"Italy, northern (Northern Italy)"
23729,"""Primitive Pontifical"" (Collection Rituals and Benedictions for the Use of a Bishop)",,"France, Auvergne (Central or Southern France, (Auvergne?)); France, central or southern"
5790,"Collection of Excerpts (Loci Communes) on Moral Topics: ""Useful Selections Produced by Various Ecclesiastical Authors, As Well as by Ancient Pagan Philosophers""/ “Ἐκλογαὶ χρήσιμοι πονηθείσαι ὑπὸ διαφόρων ποιητῶν· τῶν τὲ τῆς ἐκκλησίας· καὶ παλαιῶν φιλοσόφων καὶ ἑλλήνων","Pseudo-Maximus, Confessor, Saint (Pseudo-Maximus Confessor) (Comp); fathers of the Chruch; Aristotle (Aristotle); Demosthenes (Demosthenes); Diogenes (Diogenes); Euripides (Euripides); Epicurus (Epicurus); Plato (Plato); Socrates (Socrates)","Byzantium, Constantinople (Byzantine Empire, possibly Constantinople)"
12633,"Cantica Canticorum et Apocalypsis, cum commento",,
23724,Traicté d’aymer Dieu; Anonymous French Translation of De diligendo Dei,"Bernard, of Clairvaux, Saint, 1090 or 1091-1153 (Bernard of Clairvaux); Anonymous (Tr)",France (France)
,Epistola de morte Hieronymi; Epistola de miraculis Hieronymi; Vita Sancti Hieronymi; Vita sancti Pauli,"Pseudo-Eusebius, Cremonensis (Pseudo-Eusebius of Cremona); Pseudo-Cyrillus (Pseudo-Cyrillus [Cyril of Jerusalem]); Pseudo-Eusebius, Cremonensis (Pseudo-Eusebius of Cremona); Jerome, Saint, -419 or 420 (Hieronymus)","Italy, northern (Northern Italy)"
11648,[Vitae Patrum]; Vita Pauli primi eremitae; Vita Malchi monachi captivi; Vita Hilarioni,"Jerome, Saint, -419 or 420 (Jerome)",Italy (Italy)
21968,"Het boek de bijzondere genade; short meditations and exempla, including one from Thomas of Cantimpre, Bonum universale de apibus (Bienboec); Bonum universale de apibus","Mechthild, of Hackeborn, 1241 or 1242-1299? (Mechtild of Hackeborn); Thomas, de Cantimpré, approximately 1200-approximately 1270 (Thomas of Cantimpre)","Netherlands, northeastern, IJssel region (Northern Netherlands, Eastern part (IJssel region))"
,La voie d'enfer et de paradis,Anonymous,"France, Bourges (France, Bourges)"
20957,Historia trium regum,"Joannes, of Hildesheim, -1375 (Johannes de Hildesheim)",England (England)
23725,Elixir; Arzneibuch; Korpus der Klostermedizin,"Frauenlob, Nikolaus, von Hirschberg (Nikolaus Frauenlob von Hirschberg); Ortolf von Bayrlandt (Ortolf von Baierland)","Germany, southern, Bavaria (Germany (southern Bavaria) or Austria); Austria"
23726,"Commentary on Peter Lombard's First Book of the Sentences, related to Paulus Venetus, super primum sententiarum Johannis de Ripa Lecturae Abbreviatio","John, of Ripa, active 14th century (Johannis de Ripa); Peter Lombard; Paolo, Veneto, approximately 1370-1428 (Paul of Venice) (Ed)","Italy, northern (Northern Italy)"
23727,Office of the Dead; Prayers before celebrating Mass; Funeral service; Necrologium,,"Germany, Cologne (Germany, Cologne)"
23728,Noted Processional,,"Italy, northern (Northern Italy)"
23731,Sermones de sanctis et de communi sanctorum,"Haqueville, Nicolaus de (Nicolaus de Aquavilla)","France, northeastern, Paris (France (Paris?))"
23723,Liturgical Calendar,,Italy (Italy)
,"S. Basilii in Psalmos homiliae II-XVI; in illud: Attende tibi ipsi; quod Deus non sit auctor malorum; in principium Proverbiorum; de avaritia; in ditescentes; de jejunio homiliae duae; in ebriosos; adversus irascentes; de invidia; de gratiarum actione; in laudem Julittae martyris; in laudem Gordii martyris; in laudem XL. matyrum; in laudem Barlaami martyris; dicta in lacizis; in Christi nativitatem; exhortatoria ad baptismum; de fide; in prima verba evangelii secundum Joannem; adversus Sabellianos; ad adolescentes, de legendis gentilium libris; tempore famis et siccitatis; non adhaerescendum esse rebus saecularibus; de humilitate","Basil, Saint, Bishop of Caesarea, approximately 329-379 (S. Basilii)",
,"Anonymi commentarius in Vetus Testamentum, initio et fine mutilus; in quo fragmentum evangelii secundum Matthaeum; S. Basilii commentarius in Esaiam; Josephi testimonia de Christo et S. Joanne Baptista; S. Gregorii Nysseni epistola canonica ad Letoium, fine mutila","Anonymi (Com); Basil, Saint, Bishop of Caesarea, approximately 329-379 (S. Basilii) (Com); Josephus, Flavius (Josephi); Gregory, of Nyssa, Saint, approximately 335-approximately 394 (S. Gregorii Nysseni)",
,"S. Basilii homiliae III., initio mutila, et IV. in Hexaemeron; S. Gregorii Nazianzeni homilia in Christi nativitatem; in sancta lumina; in sanctum Pascha; Vita S. Joannis Chrysostomi, auctore Georgio Alexandrino","Basil, Saint, Bishop of Caesarea, approximately 329-379 (S. Basilii); Caesarius, of Nazianzus, Saint, -369 (S. Gregorii Nazianzeni); Georgius, Archbishop of Alexandria (Georgio Alexandrino)",
,S. Basilii in Hexaemeron homiliae IX,"Basil, Saint, Bishop of Caesarea, approximately 329-379 (S. Basilii)",
,S. Basilii in Hexaemeron homiliae IX; Vita S. Basilii; Vita S. Gregorii Nazianeni,"Basil, Saint, Bishop of Caesarea, approximately 329-379 (S. Basilii); Gregorius, Presbyter (Gregorius presbyter)",
,"S. Basilii in Hexaemeron homiliae I-III, VI-VIII, initio et fine mutilae","Basil, Saint, Bishop of Caesarea, approximately 329-379 (S. Basilii)",
,"S. Basilii homiliae IX> in Hexaemeron; S. Gregorii Nysseni tractatus de hominis opificio; ejusdem explicatio apologetica in Hexaemeron, ad Petrum fratrem; ejusdem [S. Basilii] homilia de Spiritu sancto; S. Basilii adversus Eunomium libri VI. priores; ad Amphilochium Iconiensem, de Spiritu sancto capita XXX; de vera virginitate, ad Letoium, Melitenes episcopum; homilia in ebriosos; homilia in laudem Gordii martyris; in laudem XL. martyrum; in laudem Barlaami martyris; adversus iracundos; de invidia; in illud Evangelii: Destruam horrea mea; in ditescentes; tempore famis et siccitatis; in principium Proverbiorum; exhortatoria ad baptismum; de fide; in illud: In principio erat Verbum; dicta in lacizis","Basil, Saint, Bishop of Caesarea, approximately 329-379 (S. Basilii); Gregory, of Nyssa, Saint, approximately 335-approximately 394 (S. Gregorii Nysseni)",
,"S. Basilii homiliae IX. in Hexaemeron; S. Athanasii responsa ad quaestiones Antiochi ducis; Hesychii, presbyteri Hierosolymitani, sententiae asceticae","Basil, Saint, Bishop of Caesarea, approximately 329-379 (S. Basilii); Athanasius, Saint, Patriarch of Alexandria, -373 (S. Athanasii); Hesychius, of Jerusalem, -approximately 450 (Hesychii, presbyteri Hierosolymitani)",
,"S. Cyrilli Hierosolymitani catecheses IV, VI, VII, IXXI, XVII; S. Basilii homilia tempore famis et siccitatis","Cyril, Saint, Bishop of Jerusalem, approximately 315-386 (S. Cyrilli Hierosolymitani); Basil, Saint, Bishop of Caesarea, approximately 329-379 (S. Basilii)",
,"S. Athanasii apologia pro Dionysio, Alexandrino episcopo, de eoq uod cum Ario non senserit; Definitiones geometricae","Pseudo-Athanasius, Saint, Patriarch of Alexandria (S. Athanasii)",
,"Collectio excerptorum ex SS. Patrum operibus; Anonymi fragmentum de resurrectione, initio mutilum; S. Athanasii fragmenta de Pauli Samosatensis haeresi; de Paulo, CP. episcopo; de legatis summi Pontificis male mabitis; ex epistola ad solitariam vitam agentes; de prima rerum creatione; de Prophetarum et Evangeliorum in omnibus consensu; Socratis fragmentum de Acacio, Amidae episcopo; Evagrii fragmenta duo de Chosroe, Persarum rege; Fragmentum concilii Nicaeni; S. Basilii fragmenta de paradiso; ex homiliis in Hexaemeron; Nicephori Callisti fragmenta de Paulo Samosatensis; de miraculo a Sae. Euphemia patrato; de miraculo a Sa. Glyceria patrato; de miraculo a beata Virgine patrato; de variis sanctae crucis nominibus; Origenis, SS. Cyrilli, Basilii et Hesychii fragmenta de Genesi etc; Ordo sedium patriarchae CP. obnoxiarum; Fragmentum de decem Judaeorum festis; De VII. orbis miraculis; Fragmentum de Monothelitis, Juliano Halicarnassaeo et Iconoclastis; Asterii, Amaseni episcopi, homilia in laudem Sae. Euphemiae; S. Cyrilli Alexandrini ad Succensum epistola; S. Basilii epistolae aliquot; Fragmenta ex epistolis S. Ignatii martyris; S. Athanasii epistola ad Rufinianum [ad Ephes., XVIII.]; S. Gregorii Magni fragmentum de Paschasio diacono, etc; Anonymi de mensura terrae; Photii fragmenta de jejunio quadragesimae et de apostolis; Anonymi fragmentum de S. Maria Magdalena; Photii fragmentum de animae perfectione; Anonymi fragmentum de patria Pauli apostoli; Jesu Christi ad Abgarum et Abgari ad Christum epistolae; Photii fragmenta de termino vitae et de Spiritus sancti processione; De Ptolemaeo rege et lege Mosaica; Anonymi prooemium in Psalterium; De stationibus Israelitarum in deserto; Anonymi fragmentum de Alexandro, Cleopatra, Nabuchodonosore et illius successoribus","SS. Patrum; Anonymi; Athanasius, Saint, Patriarch of Alexandria, -373 (S. Athanasii); Socrates (Socratis); Evagrius, Ponticus, 345?-399 (Evagrii); Basil, Saint, Bishop of Caesarea, approximately 329-379 (S. Basilii); Nicephorus Callistus Xanthopulus, approximately 1256-approximately 1335 (Nicephori Callisti); Origen (Origenis); Cyril, Saint, Patriarch of Alexandria, approximately 370-444  (S. Cyrilli); Basil, Saint, Bishop of Caesarea, approximately 329-379 (S. Basilii); Hesychius, of Jerusalem, -approximately 450 (S. Hesychii); Asterius, of Amasea, Saint, approximately 350-approximately 410 (Asterii, Amaseni episcopi); Ignatius, Saint, Bishop of Antioch, -approximately 110 (S. Ignatii martyris); Gregory I, Pope, approximately 540-604 (S. Gregorii Magni); Anonymi; Photius I, Saint, Patriarch of Constantinople, approximately 820-approximately 891 (Photii); Jesu Christi; Abgar V, King of Edessa, 4 B.C.-50 A.D. (Abgari)",
,Eusebii Caesariensis adversus Marcellum Ancyranum liber I; ejusdem liber de ecclesiastica theologia; Michaelis Pselli de omnifaria doctrina; Joannis Argyropuli de Spiritus sancti processione; Claudii [Caroli] a Lotharingia cardinalis interrogationes et Zachariae Cretensis reponsa de variis fidei capitibus; Isidori Pelusiotae; Michaelis Byzanti ad Sophianum epistola de processione spiritus sancti; Georgii Gemisti Plethonis de Spiritus sancti processione,"Eusebius, of Caesarea, Bishop of Caesarea, approximately 260-approximately 340 (Eusebii Caesariensis); Psellus, Michael (Michaelis Pselli); Argyropoulos, Iōannēs, -1486 (Joannis Argyropuli); Claudius (Claudii) (Attr); Carolus ([Caroli]); Isidore, of Pelusium, Saint, active 5th century (Isidori Pelusiotae); Michaelis Byzantii; Gemistus Plethon, George, active 15th century (Georgii Gemisti Plethonis); Guise, Charles de, Cardinal de Lorraine, 1525-1574 (Lorraine (Cardinal Charles De)); Zacharias Cretensis (Zacharias Cretensis)",
,Eusebii Caesariensis commentarius in Canticum canticorum; Polychronii commentarius in Canticum canticorum,"Eusebius, of Caesarea, Bishop of Caesarea, approximately 260-approximately 340 (Eusebii Caesariensis) (Com); Polychronius, diaconus (Polychronii)",
