manuscript,titles,authors,places
21967,Imitatio Christi,"Thomas, à Kempis, 1380-1471","Austria, Tyrol; Germany, southern"
299,Horologium spaientiae,"Seuse, Heinrich, 1295-1366 (Henricus Suso)","Germany, southwestern; Switzerland"
4514,Roman de la Rose; Testament,"Guillaume, de Lorris, active 1230; Jean, de Meun, approximately 1240-approximately 1305","France, central"
21502,"Confessionale; De ornatu mulierum, excerpt; Compendium de doctrina christiana; Other texts","Antoninus, Saint, Archbishop of Florence, 1389-1459 (Antoninus Florentinus); Antonio Pierozzi; Antoninus, Saint, Archbishop of Florence, 1389-1459 (Attr)","Italy, northern, Florence or Milan"
15524,Compendium theologicae vertitatis,"Hugo, Argentinensis, approximately 1210-approximately 1270. (Hugo Ripelinus Argentinensis); Hugh Ripelin of Strasbourg","Italy, northern"
21639,"Questiones in librum quartum sentetiarum, d. 1-14",Nicolaus von Dinkelsbuehl (NIcholas of Dinkelsbuhl),"Austria, Vienna; Germany, southern"
14174,De miseria humanae conditionis,"Innocent III, Pope, 1160 or 1161-1216 (Lotario dei Segni)","France, southern; Spain"
21718,Speculum monachorum; Speculum peccatoris; Synonyma (abridged and reworked),"Arnoul, de Bohéries, active 12th century (Arnulfus de Boeriis); Pseudo-Augustine, Saint, Bishop of Hippo; Isidore, of Seville, Saint, -636","Netherlands, western; Rhineland, northern, Westphalia"
1783,Regula; Regula,"Benedict, Saint, Abbot of Monte Cassino (Benedict of Nursia); Augustine, Saint, Bishop of Hippo","Italy, northern"
21674,Cato Maior de senectute; Paradoxa stoicorum; Somnium Scipionis,"Cicero, Marcus Tullius","Italy, northern"
22017,Compendium hisotriae in genealogia Christi,"Peter, of Poitiers, approximately 1130-1205  (Petrus Pictaviensis)","Italy, northern, Piedmont, Lombardy"
22063,"Antiphonal for the Day Offices, Noted",,"Netherlands, southern; Germany"
22070,De duodecim virtutibus; Epistola de novo monacho; Epistola incitativa ad spiritualem profectum (excerpt); et alia,"Groote, Gerard, 1340-1384 (Geert Grote) (Tr); Godeverd van Wevele; Groote, Gerard, 1340-1384 (Geert Grote); Thomas, à Kempis, 1380-1471","Low Countries; Germany, northwestern"
,De' fatti e detti memorabili della citta di Roma ad Tiberio Cesare,Valerius Maximus. (Valerio Massimo),
,"Prothodoxinus in ordine judicario; Super arbore consanguinitatis; Lectura super arbore affinitatis, compilata per dominum Johannem Andree, doctorem decretorum; Summa brevissima super 4to libro Decretalium...de sacramento conjugii, quod pertinet ad laicos; Tractatus de electione. Pro materia electionis est notandum...; Tractatus de tyrannide, editus per dominum Bartholum, juris civilis professorem","Petrus de Urbe; Giovanni d'Andrea, approximately 1270-1348 (Johannis Andree); Anonymous",
,Breviary,,
,Tractatus de moneta,"Oresme, Nicole, approximately 1320-1382 (Nycolao de Orem [Oresme])",
,Tractatus de electionibus,Anonymous (Anonymi),
,Rhetoricae ad Herennium libri IV,"Cicero, Marcus Tullius (M. T. Ciceronis)",
,Operum excerpta varia,"Augustine, Saint, Bishop of Hippo (S. Augustini)",
,Expositio in Cantica canticorum,"Cassiodorus, Senator, approximately 487-approximately 580 (Cassiodorii)",
,Recueil des privileges accordes par les papes a l'ordre des Freres Mineurs,,
,""" Vita beatae Clare, nuncupate de Cruce, de Montefalcone, ordinis heremitarum sancti Augustini. """,,
,"Cahiers de cours de droit civil et canon de "" Bartholomeus Pastoretus Selhanensis... Parisiis, in collegio Tricorensi "" (1580-1581) ; etc.",,
,Book of Hours; Calendrier francais,,
,De miraculis libri III,"Herberti, Turrium Sardiniae archiepiscopi",
,"Opuscula, etc.","Petrus Hispanus (Petri Hispani); Thomas, Aquinas, Saint, 1225?-1274 (S. Thomae de Aquino)",
,Summa Abel,"Petrus, Comestor, active 12th century (Petri Manducatoris)",
15777,"Miracula facta per altissimum Creatorem precibus et meritis beate Marie virginis Rose de Viterbio, tertii ordinis Minorum sancti Francisci, examinata per ... commissarios ... cardinalium ... deputatorum ... per ... Calistum ... papam tertium in causa canonizationis prefate virginis Rose ... sub anno domini 1457...",,
5346,De balneis libellus,"Savonarola, Michele, 1385?-1466? (Michaelis Savonarolae)",
,Sermones varii XIX,,
,"Images des saints ; miniatures et initiales decoupees, provenant d'un breviaire, du temps de Charles V",,
,"Opuscula, etc.","Richard, of St. Victor, -1173 (Ricardi de S. Victore); Hildebert, Archbishop of Tours, 1056?-1133 (Hildeberti Cenomanensis); Gerberti",
,Sermones pro Dominicis,,
,Breviary,,
,Distinctiones,"domini fratris Arnaldi, archiepiscopi Salernitani, doctoris sacre theologie, ordinis Minorum",
,Legenda [seu miracula] sancti Amatoris confessoris,,
,"Liber de arboribus, fructibus et arbustis, cum earum fructibus et virtutibus, editus a magistro Dominico de Aretio","Bandini, Domenico, approximately 1335-1418 (Dominico de Aretio)",
,"Carmina, etc.","Peter Riga, approximately 1140-1209 (Petri Rigae); Hildebert, Archbishop of Tours, 1056?-1133 (Hildeberti Cenomanensis)",
,Patrum opuscula varia,"Hildebert, Archbishop of Tours, 1056?-1133 (Hildeberti Cenomanensis); Innocent III, Pope, 1160 or 1161-1216 (Innocentii III papae); et al",
,Tractatus de triplici statu religiosorum,"Bonaventure, Saint, Cardinal, approximately 1217-1274 (sancti Bonaventure, cardinalis, ordinis Fratrum Minorum)",
,Recettes medicales,,
,"Opuscula, etc.","Remigius, of Auxerre, approximately 841-908 (Remigii Autissiodorensis); Hildebert, Archbishop of Tours, 1056?-1133 (Hildeberti Cenomanensis); Marbode, Bishop of Rennes, 1035?-1123 (Marbodi Redonensis)",
,Book of Hours,,
,"Vie et office de sainte Elizabeth de Thuringe, ou de Hongrie",,
,Liber de sacramentis fidei christianae,"Hugh, of Saint-Victor, 1096?-1141 (Hugonis de S. Victore)",
,"Tetrastichia ortus, vite et exitus Jesu Christi, verbi eterni incarnati, passibilis domini et redemptoris nostri",,
,Lectura primi libri Sententiarum,"Oyta, Heinrich Totting von, -1397 (Henrici de Hoyta)",
,Opuscula varia,,
,Commentarius seu postilla in Apocalypsim,Anonymous (Anonymi),
,Miscellanea theologica,,
,"Sermonum themata et excerpta e Patribus et scriptoribus ecclesiasticis, ordine alphabetico, ad usum religiosi cujusdam ordinis S. Francisci",,
,"Doctorum doctrinale, recueil d'exemples a l'usage des predicateurs",,
,Breviary,,
11189,Provinciale omnium ecclesiarum Christianarum,,
,Ordinarium ecclesie Beate Marie Cistercii,,
,Repertoire alphabetique a l'usage des predicateurs,,
,"Obituaire, offices, reglements et petit cartulaire (1271-1290) de la Grande Confrerie Notre-Dame aux pretres et bourgeois de Paris",,
,"Registre de Mahet, notaire a Corrousac (Haute-Garonne)",,
,"Liber notularum magistri Guilhermi Bancalis, notarii de Saverduno [Saverdun, Ariege] (1494-1495)",Guilhermi Bancalis,
,"Terrier des chatellenies d'Escorailles et de Reilhac (Cantal), fait pour Guy de Saint-Chamans, seigneur des dits lieux (1439)",Jacques Descuria,
,"Sapientie horologium, fratris A[mandi] (Henrici Susonis), ordinis Predicatorum, domus C., etc.",,
,De amicitia liber,"Cicero, Marcus Tullius (Marci Tulii Ciceronis)",
,Liber aureus de vita Christi,"Bonaventure, Saint, Cardinal, approximately 1217-1274 (sanctum Bonaventuram, doctorem seraphicum)",
,Tractatus de beata vita,"Augustine, Saint, Bishop of Hippo (beati Augustini)",
,"Vita Philippi Marie [Visconit], tercii Ligurum ducis, a P. Candido edita","Decembrio, Pier Candido, 1399-1477 (P. Candido)",
,"Ordo funebris pompae Baptistae Sfortiae, Urbini ducissae",,
,"Book of Hours (Petites heures, avec calendrier)",,
,Liber sex principiorum,"Gilbert, de La Porrée, Bishop, approximately 1075-1154 (Gilberti Porretani)",
,"Graecismus, initio et fine mutilus","Evrard, de Béthune (Eberhardi Bethuniensis)",
,Breviary,,
,"Breviary; Propre des Saints, etc.",,
,"Breviary; Propre du temps, Calendrier, avec table de la date de Paques, commencant en 1305; Psautier, incomplet",,
,"Prothocollum mei Bernardi Rivesaltes, regia et episcopali auctoritatibus notarii civitatis Elne",,
,Bible,,
,"Registre original de procedures de l'inquisiteur general d'Aragon contre les heretiques des dioceses de Girone, Urgel, Lerida et Vich",,
,"Sermonum themata, et excerpta theologica, initio et fine mutila",,
,Tractatus de consuetudinibus et statutis ecclesie Bajocensis,,
,Sermones,"Greve, Philippe de (Philippi de Grevia, cancellarii Parisiensis)",
,Diadema monachorum,"Smaragdus, Abbot of St. Mihiel, active 809-819 (Smaragdi)",
,Comptes de la ville de Monthey (Valais) pour l'annee 1527,,
,"Canticum canticorum, initio mutilum, et S. Joannis Apocalypsis, fine mutila, cum glosa marginali et interlineari",,
,Summa de logica,"Lambert, of Auxerre, active 1250 (Lamberti Autissiodorensis)",
,"Cartulaire de l'hopital de l'abbaye du Val-Notre-Dame, au dicoese de Paris (1214-1265)",,
11119,Summa de virtutibus,"Guilelmus Peraldus, approximately 1190-1271 (Guillelmi Peraldi)",
11210,Statuts synodaux (24 octobre 1359),"Bertrando, di La Tour, -1332? (Bertrand de La Tour, eveque de Toul)",
,Epistolae,"Peter, of Blois, approximately 1135-approximately 1212 (Petri Blesensis)",
11223,"Vocabulaire italien-latin, dedie a un grand officier [Jacques Pignatelli (?)] de la cour de Naples",,
,De cosmographia libri III; Collectanea rerum memorabilium,"Mela, Pomponius (Pomponii Melae); Solinus, C. Julius, (fl. 3rd c.)  (C. Julii Solini)",
,Distinctionum in Psalmos capitula,"Michael of Corbeil, Archbishop of Sens (Michaelis Corboliensis, Senonensis archiepiscopi)",
10896,"Opusculum, de descriptione Terre Sancte; ...insuper de simili descriptione Egypti et moribus habitatorum ejus","Burchardus, de Monte Sion, -1285 (Brocardo Theotonico)",
11152,Flores chronicorum usque ad annum 1331,"Bernardus Guidonis, Bishop of Lodève, 1261 or 1262-1331 (Barnardi Guidonis)",
,Grand Coutumier de Normandie,,
21593,"De Neapolitana Fornoviensique victoria, ad Carolum octavum, Francorum, Siciliae ac Hyerusalem regem christianissimum invictissimumque, libris II.","Andrelini, Publio Fausto, 1462-1518 (Publii Fausti)",
23535,Legenda aurea,"Jacobus, de Voragine, approximately 1229-1298 (Jacobo Januensi, ordinis Praedicatorum)",
,Opuscula,"Olivi, Pierre Jean, 1248 or 1249-1298 (Petri Joannis Olivi)",
,Libre de Recorts e dels negocis Ed(e)les rebudes y despeses fet(e)s p(er) mj Johan Beuda Canonge y cabiscoll maior d(e)la seu de gerona Comensant en los mes de Janer any mcccclxxxxvj. En Gerona,Johan Beuda,"Spain, Catalonia"
,"Obituaire, martyrologe, constitutions, etc. du prieure des Dominicaines de Sainte-Croix de Ratisbonne",,
,Opuscula medica,,
,Miscellanea juris canonici,,
,"Distinctiones sive concordantie hystoriales Veteris ac Novi Testamenti, applicabiles ad omnem materiam predicabilem",Guidone de Senis,
,Breviary,,
,Breviary (fragment),,Italy
,Book of Hours,,
,Book of Hours,,"France, Normandy"
22127,Antiphonary,,France
,Cartulaire D de l'abbaye de Cluni,,
,Consuetudines ordinis Cartusiensis; initio et fine mutilae,,
,Manuale monasticum; praecedit calendarium,,
,Commentaria in regulam S. Benedicti et Glossaria varia,,
,"Questiunculae super librum Genesim, ex dictis sanctorum patrum Augustini, Gregorii, Hieronimi et Ambrosii ; "" accedunt expositiones in libros quinque Mosaïcos, Jesu Nave, Judicum, Ruth, IV. libros Regum et prologum librorum Paralipomenon, necnon in Danielem, Actus apostolorum et Psalterium, fine mutilae.",Wigbodus (Wigbodi (?)),
,Minutie,"Marliani, Giovanni Francesco, active 1485 (Joannis Marliani)",
,Visiones sanctae Elisabeth Sconaugiensis,"Origen (Origenes); Augustine, Saint, Bishop of Hippo (Augustinus); Hildegard, Saint, 1098-1179 (Hildegardis)",
,Summa casuum conscientiae,"Raymond, of Peñafort, Saint, 1175?-1275 (Raymundi de Pennaforte)",
,Miscellanea,,
,Ars dictaminis,Bernardus Magdunensis (Bernardi de Magduno),
,Fragment d'un ancien cartulaire de l'abbaye de Cluni contenant la copie de chartes de differents rois de France,,
,"Registres des actes passes par-devant le notaire Pranlong, a Arzon, commune de Chomelix, au diocese du Puy (1472-1476)",,
,Liber hymnorum cum glosa,,
,"Censier et obituaire de l'eglise Notre-Dame de la Seds, a Aix (Bouches-du-Rhone)",,
,Sermones varii et sermonum themata,,
,Sermones,"Bernard, of Clairvaux, Saint, 1090 or 1091-1153 (S. Bernardi Claraevallensis)",
,Paschale opus...,"Sedulius, active 5th century (C. Sedulii presbyteri)",
,Practica medicinae,Anonymous (Anonymi),
,Catalogus virorum illustrium,"Jerome, Saint, -419 or 420 (S. Hieronymi)",
,Liber Excellentium,"Marzio, Galeotto, 1427-1497 (Galeotti Narniensis)",
,Alphabetum narrationum,Arnulphi,
,Recueil de traites de medecine,,
,"Dialogus novitiorum, cum vitis magistri Gherardi magni et domini Florentii [Radewijns] Daventriensis","Thomas, à Kempis, 1380-1471 (Thomae [Malleoli a Kempis])",
,"Tractatus ""de vanitate rerum mundanarum""",Anonymous (Anonymi),
,Epistolae aliquot et liber de querimonia et conflictu carnis et spiritus,"Hildebert, Archbishop of Tours, 1056?-1133 (Hildeberti Cenomanensis episcopi)",
,Legende sanctorum,"Jacobus, de Voragine, approximately 1229-1298 (Jacobus Januens[is], de ordine Predicatorum)",
,Book of Hours,,
,Sermones in honorem beatae Mariae,Anonymous (Anonymi),
,Ars versificatoria,"Gaguin, Robert, 1433-1501 (Robert)",
,Miscellanea,,
,Breviary,,
,Book of Hours / The Bourchier Prayer Book,,"England; England, Lincolnshire"
,Sermonum themata,,
,"Constitutiones sacri ordinis Montis Oliveti - M CCC LXXX, VIII kal. novembris",,
,"Obituaire de l'eglise de Saint-Barthelemy (Seine-et-Marne, arr. de Coulommiers, cant. de la Ferte-Gaucher)",,
,Allegoriae in Vetus Testamentum,"Hugh, of Saint-Victor, 1096?-1141 (Hugonis de Sancto Victore)",
,Miscellanea,,
,Rouleau d'Exultet de l'eglise de Fondi (Italie),,
,"De varietate fortunae, ad Nicolaum papam libri IV","Bracciolini, Poggio, 1380-1459 (Poggii Florentini)",
17545,Manipulus florum secundum ordinem alfabeti,"Thomas, of Ireland, approximately 1265-approximately 1329 (Thoma de Ybernia)",
,"Bucolica, Georgica et Aeneis, cum scholiis",Virgil (Publius Vergilius Maro)  (P. Virgilii Maronis),
,Chronographia ad annum 1112,"Sigebert, of Gembloux, approximately 1030-1112 (Sigeberti, monachi Gemblacensis)",
,"Chronicon, usque ad annum 1268","Frachet, Géraud de approximately 1205-1271 (Gerardi de Fracheto)",
,"Tractatus de sensu numerorum, initio mutilus",Anonymous (Anonymi),
,Book of Hours,,
,"Bible, beginning and end damaged, with corrections (Exod. XX - Act. apost. XI)",,
,"Tractatus ""de effigie sive specie virtutis""",Anonymous (Anonymi),
,Graeciae antiquae reliquiae imperatori Carolo Austrio; Epistola adhortatoria ad bellum adversus Turcas,,
,Opuscula grammatica,,
10899,"In libros Plutarchi de Placitis philosophorum naturalibus e graeco in latinum conversos, ad clarissimum virum Germanum Ganeum, parlamentarem consiliarium, Belvacensis ecclesie decanum","Budé, Guillaume, 1468-1540 (Guillelmi Budei Parisiensis, regii secretarii)",
,Vita SS. Patrum,"Jerome, Saint, -419 or 420 (S. Hieronymo)",
23703,Book of Hours,,"France, northern, Paris"
,Missal,,
,"Chronicon universale, a mundi creatione ad annum 1478",,
,"Praxeon medicinalium libri V et libri I-IV de febribus, intitio et fine mutili",Gariopontus 995-1059 (Garioponti),
10017,"Meditationes et orationes variae ; deest initium; Liber Quintilliani causidici. Cum in ea terrarum parte...; Vita sancti Laurentii; Augustinus in libro de sanct viduitate, sermones et excerpta varia theologica; Epigrammatum ex sententiis S. Augustini liber unus","Quintilian (Quintilliani); Marbode, Bishop of Rennes, 1035?-1123 (Marbodo, Redonensi episcopo); Augustine, Saint, Bishop of Hippo (Augustinus); Prosper, of Aquitaine, Saint, approximately 390-approximately 463 (S. Prosperi Aquitani)",
,Varia de astrologia et computo,,
10429,Liber de gestis Anglorum,,Scotland
,"Epistola ad Mahumetem, Turcorum imperatorem","Pius II, Pope, (b. Aeneas Silvius Bartholomeus) 1405-1464  (Pii II papae [Aeneae Silvii Piccolomini])",
,Sermones de festivitatibus,,
19688,Psalter; Breviary,,
,Collectio remediorum et medicinarum,,
,"Evangelia secundum Matthaeum, Marcum et Lucam, maxima parte mutila",,
,"Alfonsi regis dicta aut facta memoratu digna, libris IV","Beccadelli, Antonio, 1394-1471 (Anthonii Panhormite)",
,Lectionary,,
,Liber epistolarum; Liber sancti Augustini de caritate,"Julianus, Saint, Bishop of Toledo, -690 (Juliani, Tolletane civitatis episcopi); Augustine, Saint, Bishop of Hippo (sancti Augustini)",
,Missal with calendar,,
,Chronica de diversis libris collecta,"Richard of Poitiers (Richardi Pictavensis, Cluniacensis monachi)",
,"Liber sancti passagii Christicolarum contra Sarracenos pro recuperatione Terre Sancte Galvani de Levanto, Januensis umbre medici, ad illustris majestatis ac pie clementie regem dominum Phylippum, Dei gratia, regem Franchorum",,
,"Opuscula, cum scholiis","Alexander, de Villa Dei (Alexandri de Villa Dei); Johannes, de Garlandia, active 13th century (Johannis de Garlandia)",
,Historia de excidio Trojae,Dares Phrygius (Daretis Phrygii),
,Sermones de tempore et de sanctis,,
,Liber scintillarum,"Defensor, active 7th century (Defensoris Locociagensis monachi)",
,"Ligusticarum antiquitatum libellus; Recueil d'inscriptions latines du pays de Genes, ayant appartenu a l'abbe de Tersan",,
,"Vita sancti Conwoionis, abbatis Rotonensis in Armorica",,
,"Novellus musice artis tractatus pro renovando monocordi usu compilatus, in novo studio Friburgensi consumatus et per monocordum novum ad oculum declaratus",,
,Summa de sacramentis ecclesiasticis magistri Guilhelmi Parisiensis,,
,Breviary,,
,"Opuscula, etc.","Julianus, Saint, Bishop of Toledo, -690 (Juliani Toletani); Augustine, Saint, Bishop of Hippo (Augustini)",
,Varia de algorismo et computo,,
,Hystorie belli Gallici a se confecti libri VII,"Caesar, Julius (G. Julii Caesaris)",
,Tractatus de casibus reservatis et dispensationis bus (sic); Tractatus confessionis,Anonymous (Anonymi),
,Opuscula et epistolae,"Damasus I, Pope, 305-384 (Damasi); Jerome, Saint, -419 or 420 (Hieronymi); Augustine, Saint, Bishop of Hippo (Augustini)",
,Sermones de festivitatibus et sanctis,,
,"Casus breves Decretalium, compositi a magistro Ray mundo de Salgis, decretorum doctore, capellano domini nostri pape et sui sacri palatii auditore, consiliàrio et magistro requestarum hospicii excellentissimi principis domini Philippi, Dei gracia, Francerum regis","Raymundus, de Salgis, approximately 1300-1375 (Raymundo de Salgis)",
,Etymologia,"Isidore, of Seville, Saint, -636",
,"Officium Beatae Mariae Virginis, cum Calendario",,France
,Heures. Horae Beatae Mariae Virginis secundum usum Parisiensem,,"France; France, Paris"
22150,"Psalter, with glossa ordinaria and prefaces of Hilary, Augustine, and Jerome; Psalms; Bible; A la figure de la mort dictier; Hebrew and Greek alphabets; Pater and Credo, in Greek and Latin; Titulus superpositus cruci","Anselm, of Laon, -1117 (Comp); Hilary, Saint, Bishop of Poitiers, -367?; Augustine, Saint, Bishop of Hippo; Jerome, Saint, -419 or 420",
22138,"Moralia in Job, Books 1-16 and 17.1-8","Gregory I, Pope, approximately 540-604 (S. Gregoire)",
22137,"Moralia in Job, Parts 5 and 6 (Books 23 to 35); Visio Taionis, Cesaraugustani episcopi, de meritis sancti Augustini et de libris Moralium Gregorii","Gregory I, Pope, approximately 540-604 (S. Gregoire); Taio Caesaraugustanus (Taionis, Cesaraugustani episcopi)",
22136,"Moralia in Job, Parts 3 and 4 (Books 11-22); Peace treaty or charter between Hugues I, Abbot of Saint-Amand, and Anselme de Bouchain, Chatelain de Valenciennes","Gregory I, Pope, approximately 540-604 (S. Gregoire)",
22135,"Moralia in Job, Part 1 (Books 1-10)","Gregory I, Pope, approximately 540-604 (S. Gregoire)",
22149,"Job, with glossa ordinaria; Bible","Anselm, of Laon, -1117 (Comp); Jerome, Saint, -419 or 420 (S. Jerome)","France, Paris"
,"Psalterium Davidis Regis, cum Calendario",,France
,Comediae Sex,Terence (Terentius),Italy
,"Horae B.V.M. ad Usum Rothamgensem, cum Calendario",,"France; France, Rouen"
,Histoire Universelle des Anciens Royaumes,,France; England
,Manuscript (French) divided into three parts:; A History of Rome from the time of Christ; Aristotle (selections from); Treatise on Mythology,Aristotle,France
,"Carta Executoria de Higalguia a Pedimento de Hernando de Sanctiago de Avila de Herrera, Vezino de Xerex de la Frontera",,Spain
,"Psalterium Davidis, etc.","Bede, the Venerable, Saint, 673-735",Italy
,Psalterium,,Netherlands
,Gazophilacium,,
,Officium et Missa defunctorum et intonationes per Missam Cantati et Vespere,,
,"Sermones fratris Jacobi Parusini, ordinis Predicatorum, de Epistolis et Euvangeliis per totum annum","fratris Jacobi Parusini, ordinis Predicatorum",
,Recueil,,
,"Liber Apocalipsin Johannis apostoli, cum expositione Brunonis, Signensis episcopi","Bruno, di Segni, Saint, approximately 1048-1123 (Brunonis Signensis)",
,"Directorium humanae vitae, seu ""liber parabolarum antiquorum sapientum mundi nomine Kiilila et Dimna","Capuano, Francesco, active 1490 (Joannis de Capua)",
,Poetriae novae fragmentum,"Geoffrey, of Vinsauf, active 1200 (Galfridi de Vinosalvo)",
,"Distinctiones exemplorum Veteris et Novi Testamenti, compilate per fratrem Bindum, ordinis Fratrum heremitarum sancti Augustini, et sunt per alphabetum ; die xij julii, anno Domini 1386, ad peticionem fratris Johannis de Sesmondellis, lectoris de Pisis, ordinis sancte Marie de Monte Carmeli, filii supradicti conventus.""","Bindus, Senensis, active 1300 (fratrem Bindum, ordinis Fratrum heremitarum sancti Augustini)",
,Chronique des archeveques de Rouen,,
11563,"Privilegia, statuta et ordinarium Ordialis Praemonstratensis",,
,"Catalogi varii ""librorum sacrorum graecorum bibliothecae S. Marci apud Venetos""; Codicum mss. SS. Patrum graecorum bibliothecis Romanis; ""Librorum mss. theologicorum ... Fuldensis monasterii""; ""Codicum mss. bibliothecae Sfortianae""; ""Codicum mss. ad concilium Basilense [et Constantiense] pertinentium""",,
,"In Job, Regulae pastoralis et homeliarum in Evangelia fragmenta","Gregory I, Pope, approximately 540-604 (S. Gregorii Magni Moralium)",
,"Proverbia et auctoritates e diversis auctoribus sacris et profanis excerpta : ""Deliberare enim utilia mora est tutissima...""",,
,De bello punico libri III,"Bruni, Leonardo, 1369-1444  (Leonardi [Bruni] Aretini)",
,"Antiquiores consuetudines Cluniacensis monasterii, collectore sancto Uldalrico, discipulo sancti Hugonis, magni abbatis Cluniacensis",,
,"Caesarum imagines. Recueil de medailles des quatorze premiers empereurs romains, avec devises, peintes pour le cardinal Georges d'Armagnac",,
,Compilatio dictorum magistri Gerardi dicti Magni,"Guillelmi de Salvarilla, cantoris Parisiensis",
,"Secretum de thesauro experimentorum ymaginationis hominum, quod [Joannes Fontana (?)] taliter opinatus est et sub compendio conscripsit",,
,Opuscula,"Llull, Ramon, 1232?-1316 (Raymundi Lulli); Arnaldus, de Villanova, -1311 (Arnaldi de Villanova)",
,Ethicorum libri X; Magna moralia; Rhetoricorum libri III; Politicorum libri VIII; Omnia translationis grae colatinae,Aristotle (Aristotelis),
,"De notis Romanorum interpretantis libellus; Ejusdem notarum laterculus alphabeticus; Ponderum notae Prisciani grammatici; Calendarium romanum, e Fastis Ovidii; L. Annei Senecae Cordubensis liber de moribus; L. Apuleii Madaurensis, philosophi Platonici, cosmographia sive de mundo; L. Apuleii Platonici de philosophia","Probus, Marcus Valerius (Valerii Probi); Priscian, active approximately 500-530 (Prisciani); Ovid, 43 B.C.-17 A.D. or 18 A.D. (Ovidii); Seneca, Lucius Annaeus, approximately 4 B.C.-65 A.D. (L. Annei Senecae); Apuleius (L. Apuleii Madaurensis)",
,"Decretum versificatum. ""Prologus. Distinctus liber est in quinque volumina presens...Est jus divinum quod naturale vocatur...""","Gratian, active 12th century (Gratiano)",
,"Lectionarium secundum consuetudinem Romane Curie. Aux fol. 1 et 278 sont peintes des armes écartelées, aux 1 et 3 d'or à cinq écus d'argent disposés en croix, aux 2 et 4 de gueules, à un quatrefeuilles d'or, chargé d'une rose de gueules ; elles ont été recouvertes par les monogrammes du Christ et de la Vierge",,
,Supplementum Summae Pisanae,"Nicholas, of Osimo, -1453 (Nicolai de Osimo)",
,"Breviary (Breviarium ad usum carthusiae Vallis Pissii, diocesis Montis Vicii [Monreale, Sicile] ; praemittitur calendarium)",,
11528,"De ductibus aquarum libri III; Ejusdem stratagematum libri IV; Isidori Hispalensis ""libellus de temporibus""; Petri Wanafrii [Warnefridi] Forliviensis de bello Longobardorum libri VI; Petrus bibliothecarius de historia Gallorum","Frontinus, Sextus Julius (Sexti Julii Frontini); Isidore, of Seville, Saint, -636 (Isidori Hispalensis); Petri Wanafrii",
11493,Melanges de comput et d'astronomie,,
11445,"Lexicon poeticum : ""Advertat diligenter lector illud solum... Aaron, proprium nomen, Aalma, Aaronita..."" ; accedunt (fol. 146) regulae grammaticales et (fol. 159) ""tractatus de orthographia, accentu,"" etc.",Anonymous (Anonymi),
,"Carmina ad Leonardum [Bruni] Aretinum Aeneam Silvium, Leonellium et Nicolaum Estenses, Gaurinum Veronensem, Cyriacum Anconitanum, Sigismundum, Hungariae et Bohemiae regem, etc.; inter quae Homeri batrachomyomachia, Carolo [Mausuppini] Aretino interprete; Accedunt, in marginibus et ultimis foliis 145-177, Graecorum philosophorum senten tiae variae","Marrasio, Giovanni, approximately 1404-1452 (Joannis Marrasii Siculi); Marsuppini, Carlo, 1398-1453 (Carolo [Mausuppini] Aretino)",
,Breviary (Breviarii ad usum Atrebatensem pars aestivalis ; praemittitur calendarium),,
,Calendrier astronomique,,
,"Tractatus spere naturalis Joannis de Sacrobusco Anglici, anno 1464",,
,"Recueils de traites de comput et de grammaire, etc.",,
,Officia communia Sanctorum et Psalterium in divino officio dicendum secundum morem ordinis Carthusiensium; praemittitur calendarium et ordo officiorum,,
,Opuscula,"Llull, Ramon, 1232?-1316 (Raymundi Lulli)",
,Liber Jacobi Alchindi de radiis,,
,Book of Hours with calendar,,
